{
  "request_id": "req_11111111111111111111111111111111",
  "trace_id": "trace_22222222222222222222222222222222",
  "provider_id": "plugin_44444444444444444444444444444444",
  "ok": true,
  "data": {"echo": {"message": "hello"}},
  "error": null,
  "created_at": "2026-10-01T00:00:01Z",
  "protocol_version": "0.1.0-alpha.1"
}
